{"approval":{"actor_id":"member-approver-001","actor_type":"human","approval_id":"approval-synthetic-001","approved_at":"2026-07-20T10:16:00Z","approved_candidate_version":4,"authorized_evidence_ids":["evidence-backend-001","evidence-keyframe-001","evidence-repository-001","evidence-route-001","evidence-sentry-001","evidence-tap-001"],"candidate_content_digest":"sha256:b745427ba3a05ec4366c1fea950b52e7e883117e9251160b5886d6fae09b8c2f","evidence_manifest_digest":"sha256:aaaaaaaaaaaaaaaaaaaaaaaaaaaaaaaaaaaaaaaaaaaaaaaaaaaaaaaaaaaaaaaa","immutable":true,"reviewed_candidate_digest":"sha256:9999999999999999999999999999999999999999999999999999999999999999","reviewed_candidate_version":3},"build_id":"build-ios-synthetic-031","build_identity_digest":"sha256:3333333333333333333333333333333333333333333333333333333333333333","candidate_content_digest":"sha256:b745427ba3a05ec4366c1fea950b52e7e883117e9251160b5886d6fae09b8c2f","candidate_created_at":"2026-07-20T10:10:00Z","candidate_digest":"sha256:e30833bc2cc5cdac3cf5baa9b19d0b49badce6a1a11152562a3d4910b44084c7","candidate_id":"ticket-synthetic-001","candidate_version":4,"content":{"acceptance_criteria":[{"claim_refs":["claim-expected-behavior"],"criterion":"The enabled action label is Save profile in the tested locale.","criterion_id":"criterion-copy","evidence_refs":["evidence-backend-001","evidence-repository-001"],"verification":"Run the focused component test and inspect the iOS profile-form state."},{"claim_refs":["claim-observed-submit"],"criterion":"One enabled tap produces one profile update without a second tap.","criterion_id":"criterion-single-submit","evidence_refs":["evidence-backend-001","evidence-tap-001"],"verification":"Run the focused interaction test with the request adapter stub."}],"actual_behavior":{"claim_refs":["claim-observed-label","claim-observed-submit"],"evidence_refs":["evidence-backend-001","evidence-keyframe-001","evidence-route-001","evidence-tap-001"],"text":"The label is incorrect and the first tap does not submit the update."},"claims":[{"claim_id":"claim-observed-label","confidence":"high","evidence_refs":["evidence-keyframe-001","evidence-route-001"],"kind":"observed","statement":"The visible button label is Save draft, but the approved copy is Save profile.","support":"direct"},{"claim_id":"claim-observed-submit","confidence":"high","evidence_refs":["evidence-tap-001","evidence-backend-001"],"kind":"observed","statement":"The first tap emits the SDK interaction event without a matching backend request; the second tap reaches the deployment.","support":"direct"},{"claim_id":"claim-diagnosis-copy","confidence":"high","evidence_refs":["evidence-repository-001"],"kind":"diagnosis","statement":"The tested mobile revision contains the stale label in the profile-form component snapshot.","support":"direct"},{"claim_id":"claim-constraint-sentry","confidence":"medium","evidence_refs":["evidence-sentry-001"],"kind":"constraint","statement":"Sentry correlation was unavailable because the synthetic connector was intentionally revoked.","support":"inferred"},{"claim_id":"claim-expected-behavior","confidence":"high","evidence_refs":["evidence-repository-001","evidence-backend-001"],"kind":"expected","statement":"The approved behavior is Save profile copy and exactly one update on the first enabled tap.","support":"inferred"}],"clarifications":[{"choices":[{"choice_id":"choice-keep-current","consequence":"No copy correction would be requested.","description":"Keep the copy observed in the tested build.","evidence_refs":["evidence-keyframe-001"],"label":"Keep current copy","presentation":{"evidence_ref":null,"kind":"text","value":"Save draft"},"requires_note":false},{"choice_id":"choice-use-approved","consequence":"The ticket requests the approved label.","description":"Use the reviewer-approved V1 copy.","evidence_refs":["evidence-repository-001"],"label":"Use approved copy","presentation":{"evidence_ref":null,"kind":"text","value":"Save profile"},"requires_note":false}],"clarification_id":"clarification-copy-source","impact":"blocking","question":"Which copy is authoritative?","resolution_note":"Save profile is the approved English copy for V1.","selected_choice_id":"choice-use-approved","status":"resolved","target":"expected_behavior"}],"expected_behavior":{"claim_refs":["claim-expected-behavior"],"evidence_refs":["evidence-backend-001","evidence-repository-001"],"text":"The label reads Save profile and the first tap submits exactly one update."},"priority":"P1","reproduction":{"attempts":2,"preconditions":[{"claim_refs":[],"evidence_refs":[],"precondition_id":"precondition-1","text":"Use the synthetic QA account with an editable profile."},{"claim_refs":[],"evidence_refs":[],"precondition_id":"precondition-2","text":"Open the iOS build identified by this handoff."}],"reproductions":2,"steps":[{"action":"Open Settings, then select Edit profile.","actual_result":null,"claim_refs":["claim-observed-label"],"confidence":"high","evidence_refs":["evidence-route-001"],"expected_result":null,"step_id":"step-open-profile"},{"action":"Change the display name to Synthetic Reviewer.","actual_result":null,"claim_refs":["claim-observed-label"],"confidence":"high","evidence_refs":["evidence-keyframe-001"],"expected_result":null,"step_id":"step-change-name"},{"action":"Tap the visible Save draft button once and wait two seconds.","actual_result":null,"claim_refs":["claim-observed-submit"],"confidence":"high","evidence_refs":["evidence-tap-001","evidence-backend-001"],"expected_result":null,"step_id":"step-tap-save"}]},"scope":{"in_scope":["Correct the profile-form button copy.","Make a single enabled tap submit exactly once.","Add focused regression coverage."],"out_of_scope":["Do not change profile API semantics.","Do not deploy or merge from this handoff."]},"summary":{"claim_refs":["claim-observed-label","claim-observed-submit"],"evidence_refs":["evidence-backend-001","evidence-keyframe-001","evidence-route-001","evidence-tap-001"],"text":"The new profile form displays the wrong button label and submits only after a second tap."},"title":"Save button shows literal ](javascript:synthetic) copy","uncertainty":{"items":[{"evidence_refs":["evidence-sentry-001"],"impact":"non_blocking","statement":"The unavailable Sentry correlation remains an explicit non-blocking limitation.","uncertainty_id":"uncertainty-sentry-correlation"}],"overall_confidence":"medium"}},"contract_version":"tacua.ticket-candidate@1.0.0","evidence_manifest":{"evidence_ids":["evidence-backend-001","evidence-keyframe-001","evidence-repository-001","evidence-route-001","evidence-sentry-001","evidence-tap-001"],"manifest_digest":"sha256:aaaaaaaaaaaaaaaaaaaaaaaaaaaaaaaaaaaaaaaaaaaaaaaaaaaaaaaaaaaaaaaa","manifest_id":"manifest-synthetic-001"},"lineage":{"operation":"approved","parents":[{"candidate_digest":"sha256:9999999999999999999999999999999999999999999999999999999999999999","candidate_id":"ticket-synthetic-001","candidate_version":3}]},"media_type":"application/vnd.tacua.ticket-candidate+json;version=1.0.0","organization_id":"org-synthetic","previous_candidate_digest":"sha256:9999999999999999999999999999999999999999999999999999999999999999","project_id":"project-sample-mobile-app-synthetic","rejection":null,"review":{"last_human_actor_id":"member-approver-001","last_reviewed_at":"2026-07-20T10:15:30Z","notes":["Synthetic fixture review only."],"reviewer_action_required":false,"status":"reviewed"},"session_id":"session-synthetic-001","state":"approved","transition":{"actor":{"actor_id":"member-approver-001","actor_type":"human"},"from_state":"ready_for_review","occurred_at":"2026-07-20T10:16:00Z","reason":"Synthetic owner approved the exact reviewed candidate.","to_state":"approved"},"version_created_at":"2026-07-20T10:16:00Z"}
