{"approval":null,"build_id":"build_ios_031","build_identity_digest":"sha256:bbbbbbbbbbbbbbbbbbbbbbbbbbbbbbbbbbbbbbbbbbbbbbbbbbbbbbbbbbbbbbbb","candidate_content_digest":"sha256:42b82ed23cb67f48d9b73d47b8fd8cf820fbcf40db0c50ac778f18ee79720178","candidate_created_at":"2026-07-21T10:00:00Z","candidate_digest":"sha256:9f2b5c917eff5b26f3ac6b4402e09019d1a0d727b2461511e68ef3ad07fcb122","candidate_id":"candidate_profile_copy","candidate_version":1,"content":{"acceptance_criteria":[{"claim_refs":["claim_expected_label"],"criterion":"The enabled profile action reads Save profile in the tested locale.","criterion_id":"criterion_profile_copy","evidence_refs":["evidence_transcript_001","evidence_repository_001"],"verification":"Run the focused profile component test and inspect the iOS QA build."}],"actual_behavior":{"claim_refs":["claim_observed_label"],"evidence_refs":["evidence_keyframe_001"],"text":"The enabled profile action is labelled Save draft."},"claims":[{"claim_id":"claim_observed_label","confidence":"high","evidence_refs":["evidence_keyframe_001"],"kind":"observed","statement":"The tested build renders Save draft on the profile action.","support":"direct"},{"claim_id":"claim_expected_label","confidence":"high","evidence_refs":["evidence_transcript_001","evidence_repository_001"],"kind":"expected","statement":"The reviewer and tested repository identify Save profile as the intended copy.","support":"inferred"},{"claim_id":"claim_profile_route","confidence":"high","evidence_refs":["evidence_route_001"],"kind":"constraint","statement":"The observation occurs on the profile-edit route.","support":"direct"}],"clarifications":[{"choices":[{"choice_id":"choice_keep_current","consequence":"No copy change would be requested.","description":"Keep the copy visible in the captured build.","evidence_refs":["evidence_keyframe_001"],"label":"Keep Save draft","presentation":{"evidence_ref":"evidence_keyframe_001","kind":"evidence_thumbnail","value":null},"requires_note":false},{"choice_id":"choice_use_approved","consequence":"The implementation ticket requests the Save profile label.","description":"Use the reviewer-stated and repository-backed copy.","evidence_refs":["evidence_transcript_001","evidence_repository_001"],"label":"Use Save profile","presentation":{"evidence_ref":null,"kind":"text","value":"Save profile"},"requires_note":false}],"clarification_id":"clarification_copy_source","impact":"blocking","question":"Which label should the enabled profile action use?","resolution_note":null,"selected_choice_id":null,"status":"unresolved","target":"expected_behavior"}],"expected_behavior":{"claim_refs":["claim_expected_label"],"evidence_refs":["evidence_transcript_001","evidence_repository_001"],"text":"The enabled profile action should be labelled Save profile."},"priority":"P2","reproduction":{"attempts":1,"preconditions":[{"claim_refs":["claim_profile_route"],"evidence_refs":["evidence_route_001"],"precondition_id":"precondition_profile_editable","text":"Use an authorized QA account with an editable profile."}],"reproductions":1,"steps":[{"action":"Open Settings and select Edit profile.","actual_result":"The profile editor opens.","claim_refs":["claim_profile_route"],"confidence":"high","evidence_refs":["evidence_route_001"],"expected_result":"The profile editor opens.","step_id":"step_open_profile"},{"action":"Inspect the enabled primary action.","actual_result":"The label reads Save draft.","claim_refs":["claim_observed_label","claim_expected_label"],"confidence":"high","evidence_refs":["evidence_keyframe_001","evidence_transcript_001"],"expected_result":"The label reads Save profile.","step_id":"step_inspect_action"}]},"scope":{"in_scope":["Correct the profile action copy in the tested iOS build."],"out_of_scope":["Do not change profile API behavior or deploy from this candidate."]},"summary":{"claim_refs":["claim_observed_label","claim_expected_label"],"evidence_refs":["evidence_keyframe_001","evidence_transcript_001"],"text":"The profile action shows Save draft instead of the approved Save profile copy."},"title":"Profile action uses the wrong label","uncertainty":{"items":[{"evidence_refs":["evidence_repository_001"],"impact":"non_blocking","statement":"Copy for locales outside the tested English build was not inspected.","uncertainty_id":"uncertainty_other_locales"}],"overall_confidence":"high"}},"contract_version":"tacua.ticket-candidate@1.0.0","evidence_manifest":{"evidence_ids":["evidence_keyframe_001","evidence_repository_001","evidence_route_001","evidence_transcript_001"],"manifest_digest":"sha256:aaaaaaaaaaaaaaaaaaaaaaaaaaaaaaaaaaaaaaaaaaaaaaaaaaaaaaaaaaaaaaaa","manifest_id":"manifest_synthetic_001"},"lineage":{"operation":"generated","parents":[]},"media_type":"application/vnd.tacua.ticket-candidate+json;version=1.0.0","organization_id":"org_synthetic","previous_candidate_digest":null,"project_id":"project_sample_mobile","rejection":null,"review":{"last_human_actor_id":null,"last_reviewed_at":null,"notes":[],"reviewer_action_required":false,"status":"unreviewed"},"session_id":"session_synthetic_001","state":"draft","transition":{"actor":{"actor_id":"worker_local","actor_type":"system"},"from_state":null,"occurred_at":"2026-07-21T10:00:00Z","reason":"processing_job_generated_candidate","to_state":"draft"},"version_created_at":"2026-07-21T10:00:00Z"}
